{
  "elf_path": "/home/niteris/dev/fastled-memory-dashboard/.cache/build/teensy41/dec101a1268e013ef42deee644ff58883179d61a-ee0b36e3cdd3/.fbuild/build/teensy41/release/firmware.elf",
  "map_path": "/home/niteris/dev/fastled-memory-dashboard/.cache/build/teensy41/dec101a1268e013ef42deee644ff58883179d61a-ee0b36e3cdd3/.fbuild/build/teensy41/release/firmware.map",
  "total_flash": 18350,
  "total_ram": 24497,
  "image_flash": 28672,
  "symbols": [
    {
      "mangled": "txbuffer",
      "demangled": "txbuffer",
      "address": 538973344,
      "size": 8192,
      "sym_type": "b",
      "region": "ram",
      "archive": null,
      "object": "ccet7JUR.ltrans0.ltrans.o",
      "output_section": ".bss.dma",
      "source": "nm",
      "referenced_by": [],
      "references_to": [],
      "called_by": []
    },
    {
      "mangled": "_ZN2fl10ObjectFLED7bitdataE",
      "demangled": "fl::ObjectFLED::bitdata",
      "address": 538968192,
      "size": 5120,
      "sym_type": "B",
      "region": "ram",
      "archive": null,
      "object": "ccet7JUR.ltrans0.ltrans.o",
      "output_section": ".bss.dma",
      "source": "nm",
      "referenced_by": [],
      "references_to": [],
      "called_by": []
    },
    {
      "mangled": "rx_buffer",
      "demangled": "rx_buffer",
      "address": 538981536,
      "size": 4096,
      "sym_type": "b",
      "region": "ram",
      "archive": null,
      "object": "ccet7JUR.ltrans0.ltrans.o",
      "output_section": ".bss.dma",
      "source": "nm",
      "referenced_by": [],
      "references_to": [],
      "called_by": []
    },
    {
      "mangled": "hab_csf",
      "demangled": "hab_csf",
      "address": 1610638336,
      "size": 3072,
      "sym_type": "R",
      "region": "flash",
      "archive": null,
      "object": "ccet7JUR.ltrans0.ltrans.o",
      "output_section": ".text.csf",
      "source": "nm",
      "referenced_by": [],
      "references_to": [],
      "called_by": []
    },
    {
      "mangled": "ResetHandler2",
      "demangled": "ResetHandler2",
      "address": 1610617900,
      "size": 2204,
      "sym_type": "t",
      "region": "flash",
      "archive": null,
      "object": "ccet7JUR.ltrans0.ltrans.o",
      "output_section": ".text.code",
      "source": "nm",
      "referenced_by": [],
      "references_to": [
        "memory_copy",
        "memory_clear.constprop.0",
        "__set_arm_clock_veneer",
        "flexspi2_psram_size",
        "flexspi2_command",
        "__memset_veneer",
        "____errno_veneer",
        "__flexpwm_init_veneer",
        "__quadtimer_init_veneer",
        "__delay.part.0_veneer",
        "startup_debug_reset",
        "____libc_init_array_veneer",
        "__main_veneer"
      ],
      "called_by": [
        "ResetHandler"
      ]
    },
    {
      "mangled": "usb_isr",
      "demangled": "usb_isr",
      "address": 6528,
      "size": 1428,
      "sym_type": "t",
      "region": "flash",
      "archive": null,
      "object": null,
      "output_section": null,
      "source": "nm",
      "referenced_by": [],
      "references_to": [
        "___reboot_Teensyduino__veneer",
        "run_callbacks",
        "memcpy",
        "endpoint0_receive",
        "memset",
        "rx_queue_transfer",
        "endpoint0_transmit.constprop.0"
      ],
      "called_by": [
        "unused_interrupt_vector"
      ]
    },
    {
      "mangled": "_malloc_r",
      "demangled": "_malloc_r",
      "address": 10604,
      "size": 1376,
      "sym_type": "T",
      "region": "flash",
      "archive": "libc.a",
      "object": "libc_a-mallocr.o",
      "output_section": ".text.itcm",
      "source": "nm",
      "referenced_by": [],
      "references_to": [
        "__malloc_lock",
        "__malloc_unlock",
        "_sbrk_r",
        "_free_r"
      ],
      "called_by": [
        "_memalign_r",
        "malloc"
      ]
    },
    {
      "mangled": "__malloc_av_",
      "demangled": "__malloc_av_",
      "address": 536873332,
      "size": 1032,
      "sym_type": "D",
      "region": "ram",
      "archive": "libc.a",
      "object": "libc_a-mallocr.o",
      "output_section": ".data",
      "source": "nm",
      "referenced_by": [],
      "references_to": [],
      "called_by": []
    },
    {
      "mangled": "digital_pin_to_info_PGM",
      "demangled": "digital_pin_to_info_PGM",
      "address": 536871584,
      "size": 880,
      "sym_type": "d",
      "region": "ram",
      "archive": null,
      "object": "ccet7JUR.ltrans0.ltrans.o",
      "output_section": ".data",
      "source": "nm",
      "referenced_by": [],
      "references_to": [],
      "called_by": []
    },
    {
      "mangled": "_ZN16APA102ControllerILh11ELh13EL6EOrder10ELm6000000ELN2fl26FiveBitGammaCorrectionModeE0ELm0ELm4278190080EE10showPixelsER15PixelControllerILS0_10ELi1ELm4294967295EE",
      "demangled": "APA102Controller<(unsigned char)11, (unsigned char)13, (EOrder)10, 6000000ul, (fl::FiveBitGammaCorrectionMode)0, 0ul, 4278190080ul>::showPixels(PixelController<(EOrder)10, 1, 4294967295ul>&)",
      "address": 3912,
      "size": 780,
      "sym_type": "t",
      "region": "flash",
      "archive": null,
      "object": null,
      "output_section": null,
      "source": "nm",
      "referenced_by": [],
      "references_to": [
        "_ZN8SPIClass16beginTransactionE11SPISettings.constprop.0",
        "_ZN8SPIClass8transferEh.constprop.0.isra.0",
        "_ZN8SPIClass14endTransactionEv.constprop.0"
      ],
      "called_by": []
    },
    {
      "mangled": "_VectorsRam",
      "demangled": "_VectorsRam",
      "address": 536875008,
      "size": 704,
      "sym_type": "D",
      "region": "ram",
      "archive": null,
      "object": "ccet7JUR.ltrans0.ltrans.o",
      "output_section": ".data",
      "source": "nm",
      "referenced_by": [],
      "references_to": [],
      "called_by": []
    },
    {
      "mangled": "endpoint_queue_head",
      "demangled": "endpoint_queue_head",
      "address": 536870912,
      "size": 640,
      "sym_type": "D",
      "region": "ram",
      "archive": null,
      "object": "ccet7JUR.ltrans0.ltrans.o",
      "output_section": ".data",
      "source": "nm",
      "referenced_by": [],
      "references_to": [],
      "called_by": []
    },
    {
      "mangled": "set_arm_clock",
      "demangled": "set_arm_clock",
      "address": 664,
      "size": 524,
      "sym_type": "t",
      "region": "flash",
      "archive": "libc.a",
      "object": "libc_a-sbrkr.o",
      "output_section": ".rel.dyn",
      "source": "nm",
      "referenced_by": [],
      "references_to": [],
      "called_by": [
        "unused_interrupt_vector"
      ]
    },
    {
      "mangled": "_free_r",
      "demangled": "_free_r",
      "address": 9908,
      "size": 524,
      "sym_type": "T",
      "region": "flash",
      "archive": "libc.a",
      "object": "libc_a-freer.o",
      "output_section": ".text.itcm",
      "source": "nm",
      "referenced_by": [],
      "references_to": [
        "__malloc_lock",
        "__malloc_unlock",
        "_malloc_trim_r"
      ],
      "called_by": [
        "_malloc_r",
        "_memalign_r",
        "free"
      ]
    },
    {
      "mangled": "FlexSPI_NOR_Config",
      "demangled": "FlexSPI_NOR_Config",
      "address": 1610612736,
      "size": 512,
      "sym_type": "D",
      "region": "ram",
      "archive": null,
      "object": "ccet7JUR.ltrans0.ltrans.o",
      "output_section": ".text.headers",
      "source": "nm",
      "referenced_by": [],
      "references_to": [],
      "called_by": []
    },
    {
      "mangled": "unused_interrupt_vector",
      "demangled": "unused_interrupt_vector",
      "address": 7956,
      "size": 500,
      "sym_type": "T",
      "region": "flash",
      "archive": null,
      "object": null,
      "output_section": null,
      "source": "nm",
      "referenced_by": [],
      "references_to": [
        "set_arm_clock",
        "usb_isr"
      ],
      "called_by": [
        "Panic_Temp_isr"
      ]
    },
    {
      "mangled": "_ZN8CFastLED4showEh.constprop.0",
      "demangled": "CFastLED::show(unsigned char) [clone .constprop.0]",
      "address": 6088,
      "size": 440,
      "sym_type": "t",
      "region": "flash",
      "archive": null,
      "object": null,
      "output_section": null,
      "source": "nm",
      "referenced_by": [],
      "references_to": [
        "_ZN2fl9SingletonINS_12EngineEventsELi0EE8instanceEv",
        "_ZN2fl13InlinedVectorINS_12EngineEvents4PairELj16EEC2ERKS3_.isra.0",
        "_ZN2fl13InlinedVectorINS_12EngineEvents4PairELj16EE3endEv",
        "_ZN2fl13InlinedVectorINS_12EngineEvents4PairELj16EED2Ev.isra.0",
        "micros"
      ],
      "called_by": [
        "main"
      ]
    },
    {
      "mangled": "__atexit0",
      "demangled": "__atexit0",
      "address": 536877256,
      "size": 400,
      "sym_type": "B",
      "region": "ram",
      "archive": "libc.a",
      "object": "libc_a-__atexit.o",
      "output_section": ".bss",
      "source": "nm",
      "referenced_by": [],
      "references_to": [],
      "called_by": []
    },
    {
      "mangled": "usb_serial_write.part.0",
      "demangled": "usb_serial_write.part.0",
      "address": 5304,
      "size": 352,
      "sym_type": "t",
      "region": "flash",
      "archive": null,
      "object": null,
      "output_section": null,
      "source": "nm",
      "referenced_by": [],
      "references_to": [
        "memcpy",
        "usb_prepare_transfer",
        "schedule_transfer",
        "yield"
      ],
      "called_by": [
        "_ZN16usb_serial_class5writeEPKhj",
        "_ZN16usb_serial_class5writeEh"
      ]
    },
    {
      "mangled": "__sf",
      "demangled": "__sf",
      "address": 536877716,
      "size": 312,
      "sym_type": "B",
      "region": "ram",
      "archive": "libc.a",
      "object": "libc_a-findfp.o",
      "output_section": ".bss",
      "source": "nm",
      "referenced_by": [],
      "references_to": [],